{
  "schema_version": 1,
  "repository": "github.com/faustbrian/go-library-tools",
  "module": ".",
  "package": "internal/inventory",
  "gate": "mutation",
  "input_digest": "sha256:4dc4128f6709bd48a1ee3a354433a963eb2c985ca705498fc197057c6e93cc4b",
  "verifier_digest": "sha256:9a9499ff68a8dfd49a0be7995590297a8ee563a1aa226bfd8b9361dc53058108",
  "result": "passed",
  "report_digest": "sha256:64da4540e6e86b767615dafd8c194140b87d9b825a8eb4622e169502e927e05b",
  "environment": {
    "CGO_ENABLED": "1",
    "GOARCH": "arm64",
    "GOOS": "darwin",
    "GOVERSION": "go1.27.0",
    "gremlins_binary_sha256": "sha256:6a2beddc477eb410f8a670b6c9049558563d3c4327498fe31604d31c773a959e"
  },
  "completed_at": "2026-08-26T23:39:10.937665Z"
}
