{
  "schema_version": 1,
  "repository": "github.com/faustbrian/go-library-tools",
  "module": ".",
  "package": "internal/config",
  "gate": "mutation",
  "input_digest": "sha256:7b6459907d33917de1ffedb51b54e68227502461cda6921b050b32c488391159",
  "verifier_digest": "sha256:9a9499ff68a8dfd49a0be7995590297a8ee563a1aa226bfd8b9361dc53058108",
  "result": "passed",
  "report_digest": "sha256:db6f626efbbcd747ba22de26617627c772a9de905ad7019321437aed30c7d813",
  "environment": {
    "CGO_ENABLED": "1",
    "GOARCH": "arm64",
    "GOOS": "darwin",
    "GOVERSION": "go1.27.0",
    "gremlins_binary_sha256": "sha256:6a2beddc477eb410f8a670b6c9049558563d3c4327498fe31604d31c773a959e"
  },
  "completed_at": "2026-08-27T02:57:11.335563Z"
}
