{
  "schema_version": 1,
  "repository": "github.com/faustbrian/go-library-tools",
  "module": ".",
  "package": "cmd/golib",
  "gate": "mutation",
  "input_digest": "sha256:b951132483708c609cac4621911577f928c9e3ec9831a60c08256fbcdc4ad218",
  "verifier_digest": "sha256:9a9499ff68a8dfd49a0be7995590297a8ee563a1aa226bfd8b9361dc53058108",
  "result": "passed",
  "report_digest": "sha256:017a4fb2cbc1f6e3515763d0c80c821fc295dbe6d37d40baf25aea4bc62fd085",
  "environment": {
    "CGO_ENABLED": "1",
    "GOARCH": "arm64",
    "GOOS": "darwin",
    "GOVERSION": "go1.27.0",
    "gremlins_binary_sha256": "sha256:6a2beddc477eb410f8a670b6c9049558563d3c4327498fe31604d31c773a959e"
  },
  "completed_at": "2026-08-30T10:46:34.133808Z"
}
