{
  "schema_version": 1,
  "repository": "github.com/faustbrian/go-library-tools",
  "module": ".",
  "package": "cmd/golib",
  "gate": "mutation",
  "input_digest": "sha256:173157ef85f30305a4bdb10c311b1fad4dab169fb33d45fad4ea76de17e471cb",
  "verifier_digest": "sha256:9a9499ff68a8dfd49a0be7995590297a8ee563a1aa226bfd8b9361dc53058108",
  "result": "passed",
  "report_digest": "sha256:ccf32ede668a1e427880fec62c6ebffacb7933307f576c7058b3aaa6524bdd35",
  "environment": {
    "CGO_ENABLED": "1",
    "GOARCH": "arm64",
    "GOOS": "darwin",
    "GOVERSION": "go1.27.0",
    "gremlins_binary_sha256": "sha256:6a2beddc477eb410f8a670b6c9049558563d3c4327498fe31604d31c773a959e"
  },
  "completed_at": "2026-08-27T07:11:51.33808Z"
}
