{
  "schema_version": 1,
  "repository": "github.com/faustbrian/go-library-tools",
  "module": ".",
  "package": "internal/releasecheck",
  "gate": "mutation",
  "input_digest": "sha256:73f63a30a0644d454229a1075133640c21e86c14dfb418e113a200cd7fa6e94f",
  "verifier_digest": "sha256:9a9499ff68a8dfd49a0be7995590297a8ee563a1aa226bfd8b9361dc53058108",
  "result": "passed",
  "report_digest": "sha256:7622bf9ae78a5a459d39776b0db4509877bbd8db017f51c4dd6518c6b9f5168c",
  "environment": {
    "CGO_ENABLED": "1",
    "GOARCH": "arm64",
    "GOOS": "darwin",
    "GOVERSION": "go1.27.0",
    "gremlins_binary_sha256": "sha256:6a2beddc477eb410f8a670b6c9049558563d3c4327498fe31604d31c773a959e"
  },
  "completed_at": "2026-08-27T04:00:50.197199Z"
}
