{
  "schema_version": 1,
  "repository": "github.com/faustbrian/go-library-tools",
  "module": ".",
  "package": "cmd/golib",
  "gate": "mutation",
  "input_digest": "sha256:b0f92e511e4600d960109b5a893006917f99fbd6bab7bc53f23cfb48e2a7ad02",
  "verifier_digest": "sha256:9a9499ff68a8dfd49a0be7995590297a8ee563a1aa226bfd8b9361dc53058108",
  "result": "passed",
  "report_digest": "sha256:1056104f12e4d523cafa7f2979bc39e809c4a059c28877006d4b627a88322374",
  "environment": {
    "CGO_ENABLED": "1",
    "GOARCH": "arm64",
    "GOOS": "darwin",
    "GOVERSION": "go1.27.0",
    "gremlins_binary_sha256": "sha256:6a2beddc477eb410f8a670b6c9049558563d3c4327498fe31604d31c773a959e"
  },
  "completed_at": "2026-08-27T01:57:02.528274Z"
}
