{
  "schema_version": 1,
  "repository": "github.com/faustbrian/go-library-tools",
  "module": ".",
  "package": "internal/gates",
  "gate": "mutation",
  "input_digest": "sha256:ced24777133a05a30a41c9f1d6f604f6890dfa1033982790f80222501db0ecdc",
  "verifier_digest": "sha256:9a9499ff68a8dfd49a0be7995590297a8ee563a1aa226bfd8b9361dc53058108",
  "result": "passed",
  "report_digest": "sha256:8e51f449520469f0b061fd78d052077efd806210a85469643188203bfc771595",
  "environment": {
    "CGO_ENABLED": "1",
    "GOARCH": "amd64",
    "GOOS": "linux",
    "GOVERSION": "go1.27.0",
    "gremlins_binary_sha256": "sha256:c445d9c04ffe4d2070617fd4df511cb19e48135950462912be29133b1b0169cc"
  },
  "completed_at": "2026-08-28T12:39:33.213497715Z"
}
