{
  "schema_version": 1,
  "repository": "github.com/faustbrian/go-library-tools",
  "module": ".",
  "package": "internal/cli",
  "gate": "mutation",
  "input_digest": "sha256:e05d703060bfece2bae0b7828729732468e6ff61ae2d1b930448a6aafa0c03bc",
  "verifier_digest": "sha256:9a9499ff68a8dfd49a0be7995590297a8ee563a1aa226bfd8b9361dc53058108",
  "result": "passed",
  "report_digest": "sha256:ee031b1ffff993fbb7f639a9cf606671b6488787b24f67ecdbee3d6b255e4d33",
  "environment": {
    "CGO_ENABLED": "1",
    "GOARCH": "arm64",
    "GOOS": "darwin",
    "GOVERSION": "go1.27.0",
    "gremlins_binary_sha256": "sha256:6a2beddc477eb410f8a670b6c9049558563d3c4327498fe31604d31c773a959e"
  },
  "completed_at": "2026-08-30T10:47:57.835822Z"
}
