{
  "schema_version": 1,
  "repository": "github.com/faustbrian/go-library-tools",
  "module": ".",
  "package": "internal/repositoryfile",
  "gate": "mutation",
  "input_digest": "sha256:37a3827af6d7422915f674bec4b72654c61ebb12495a18ff3b466b67f2d0b70e",
  "verifier_digest": "sha256:9a9499ff68a8dfd49a0be7995590297a8ee563a1aa226bfd8b9361dc53058108",
  "result": "passed",
  "report_digest": "sha256:482cc784218e2952078509dac3316168bf61387af4495ab86e0f71a3ff1bd530",
  "environment": {
    "CGO_ENABLED": "1",
    "GOARCH": "arm64",
    "GOOS": "darwin",
    "GOVERSION": "go1.27.0",
    "gremlins_binary_sha256": "sha256:6a2beddc477eb410f8a670b6c9049558563d3c4327498fe31604d31c773a959e"
  },
  "completed_at": "2026-08-31T07:03:17.128816Z"
}
