{
  "schema_version": 1,
  "repository": "github.com/faustbrian/go-library-tools",
  "module": ".",
  "package": "internal/docscheck",
  "gate": "mutation",
  "input_digest": "sha256:0cd6bf72dcb797528037e692030cd6b83d1a0ecb571547b6c18c66f7b0473905",
  "verifier_digest": "sha256:9a9499ff68a8dfd49a0be7995590297a8ee563a1aa226bfd8b9361dc53058108",
  "result": "passed",
  "report_digest": "sha256:723e73ba4afcab37bbed5d9f7499d1bb58a95713aa2d8d0425ffef5b69e00666",
  "environment": {
    "CGO_ENABLED": "1",
    "GOARCH": "arm64",
    "GOOS": "darwin",
    "GOVERSION": "go1.27.0",
    "gremlins_binary_sha256": "sha256:6a2beddc477eb410f8a670b6c9049558563d3c4327498fe31604d31c773a959e"
  },
  "completed_at": "2026-08-29T09:21:51.303446Z"
}
