{
  "schema_version": 1,
  "repository": "github.com/faustbrian/go-library-tools",
  "module": ".",
  "package": "cmd/golib",
  "gate": "mutation",
  "input_digest": "sha256:be2da3aa6ba59d713e227d7e7e3512eff428100375568c203a9e6ec705ee990d",
  "verifier_digest": "sha256:9a9499ff68a8dfd49a0be7995590297a8ee563a1aa226bfd8b9361dc53058108",
  "result": "passed",
  "report_digest": "sha256:451b5526b8b26ebddb2b45c958298de541eda6bef94a06a32d39a9068bbd6790",
  "environment": {
    "CGO_ENABLED": "1",
    "GOARCH": "arm64",
    "GOOS": "darwin",
    "GOVERSION": "go1.27.0",
    "gremlins_binary_sha256": "sha256:6a2beddc477eb410f8a670b6c9049558563d3c4327498fe31604d31c773a959e"
  },
  "completed_at": "2026-08-27T01:39:48.540272Z"
}
