{
  "schema_version": 1,
  "repository": "github.com/faustbrian/go-library-tools",
  "module": ".",
  "package": "internal/cli",
  "gate": "mutation",
  "input_digest": "sha256:e4042f08369cf88ce08f11fb480f01db69e3a7376b5d1bee7527a1b074dc10db",
  "verifier_digest": "sha256:9a9499ff68a8dfd49a0be7995590297a8ee563a1aa226bfd8b9361dc53058108",
  "result": "passed",
  "report_digest": "sha256:ec4c396a009dfcb92f5ad5e607b06aaf60e366a9d8255093488eead73d609e91",
  "environment": {
    "CGO_ENABLED": "1",
    "GOARCH": "amd64",
    "GOOS": "linux",
    "GOVERSION": "go1.27.0",
    "gremlins_binary_sha256": "sha256:c445d9c04ffe4d2070617fd4df511cb19e48135950462912be29133b1b0169cc"
  },
  "completed_at": "2026-08-28T08:50:12.688076629Z"
}
