{
  "schema_version": 1,
  "repository": "github.com/faustbrian/go-library-tools",
  "module": ".",
  "package": "internal/inventory",
  "gate": "mutation",
  "input_digest": "sha256:dc66a8ba86682905ac0142de0120a139710f2f8d96d6cc6ec730de8feb797854",
  "verifier_digest": "sha256:9a9499ff68a8dfd49a0be7995590297a8ee563a1aa226bfd8b9361dc53058108",
  "result": "passed",
  "report_digest": "sha256:f48a47059f27b6c9bb806385a9fefdf2669f0591a27c52083ea7362faa9c6f43",
  "environment": {
    "CGO_ENABLED": "1",
    "GOARCH": "arm64",
    "GOOS": "darwin",
    "GOVERSION": "go1.27.0",
    "gremlins_binary_sha256": "sha256:6a2beddc477eb410f8a670b6c9049558563d3c4327498fe31604d31c773a959e"
  },
  "completed_at": "2026-08-27T00:51:40.207821Z"
}
