{
  "schema_version": 1,
  "repository": "github.com/faustbrian/go-library-tools",
  "module": ".",
  "package": "internal/buildinfo",
  "gate": "mutation",
  "input_digest": "sha256:c7b3995772baf75f33aaeef2578018757321e45180e7292c14a2f982f03971ae",
  "verifier_digest": "sha256:9a9499ff68a8dfd49a0be7995590297a8ee563a1aa226bfd8b9361dc53058108",
  "result": "passed",
  "report_digest": "sha256:a4c8ac3a3790c7f3572fc0382dbbfd0616f7c9e451e8ff535a14f6cbae608ed1",
  "environment": {
    "CGO_ENABLED": "1",
    "GOARCH": "arm64",
    "GOOS": "darwin",
    "GOVERSION": "go1.27.0",
    "gremlins_binary_sha256": "sha256:6a2beddc477eb410f8a670b6c9049558563d3c4327498fe31604d31c773a959e"
  },
  "completed_at": "2026-08-26T20:59:00.004408Z"
}
