{
  "schema_version": 1,
  "repository": "github.com/faustbrian/go-library-tools",
  "module": ".",
  "package": "internal/services",
  "gate": "mutation",
  "input_digest": "sha256:734dfe6b1a394b21508048760ad51778ba99b9d47c52cb212b5998e7f89d6d62",
  "verifier_digest": "sha256:9a9499ff68a8dfd49a0be7995590297a8ee563a1aa226bfd8b9361dc53058108",
  "result": "passed",
  "report_digest": "sha256:ae0a2e192dd92a1d69c48c6cde9c74f41f29568348acd5379bbd6676d376f028",
  "environment": {
    "CGO_ENABLED": "1",
    "GOARCH": "amd64",
    "GOOS": "linux",
    "GOVERSION": "go1.27.0",
    "gremlins_binary_sha256": "sha256:c445d9c04ffe4d2070617fd4df511cb19e48135950462912be29133b1b0169cc"
  },
  "completed_at": "2026-08-28T09:16:17.889642355Z"
}
