{
  "schema_version": 1,
  "repository": "github.com/faustbrian/go-library-tools",
  "module": ".",
  "package": "internal/inventory",
  "gate": "mutation",
  "input_digest": "sha256:f9df051048373fcbb8b78981159934a818d43476cccf5bafbd3d4851eb65eb33",
  "verifier_digest": "sha256:9a9499ff68a8dfd49a0be7995590297a8ee563a1aa226bfd8b9361dc53058108",
  "result": "passed",
  "report_digest": "sha256:58f0d9bb2be0c8c3bd9eef749a939022d7f23ad8b442de5c67404298ca79559a",
  "environment": {
    "CGO_ENABLED": "1",
    "GOARCH": "arm64",
    "GOOS": "darwin",
    "GOVERSION": "go1.27.0",
    "gremlins_binary_sha256": "sha256:6a2beddc477eb410f8a670b6c9049558563d3c4327498fe31604d31c773a959e"
  },
  "completed_at": "2026-08-27T02:59:15.584127Z"
}
