{
  "schema_version": 1,
  "repository": "github.com/faustbrian/go-library-tools",
  "module": ".",
  "package": "internal/releasecheck",
  "gate": "mutation",
  "input_digest": "sha256:a37a31b0dcb8ee4588e7c2dc66f93d35b2cc91440129e886586eb80d285f16f4",
  "verifier_digest": "sha256:9a9499ff68a8dfd49a0be7995590297a8ee563a1aa226bfd8b9361dc53058108",
  "result": "passed",
  "report_digest": "sha256:789e4d682d330f00f99fa8f274faeb4e8f23af7abeffd43e81abfde22e3b5b1f",
  "environment": {
    "CGO_ENABLED": "1",
    "GOARCH": "arm64",
    "GOOS": "darwin",
    "GOVERSION": "go1.27.0",
    "gremlins_binary_sha256": "sha256:6a2beddc477eb410f8a670b6c9049558563d3c4327498fe31604d31c773a959e"
  },
  "completed_at": "2026-08-27T02:30:20.864474Z"
}
