{
  "schema_version": 1,
  "repository": "github.com/faustbrian/go-library-tools",
  "module": ".",
  "package": "internal/gates",
  "gate": "mutation",
  "input_digest": "sha256:763f94edc0c91a59db8c873d2daa364554941503f45466d6fbf2399ff6b25f5f",
  "verifier_digest": "sha256:9a9499ff68a8dfd49a0be7995590297a8ee563a1aa226bfd8b9361dc53058108",
  "result": "passed",
  "report_digest": "sha256:de6c91cd9cc6fb314b7f9a4c99f7c9b88141f0e2dd96071bffa29d8c38d0fdb9",
  "environment": {
    "CGO_ENABLED": "1",
    "GOARCH": "arm64",
    "GOOS": "darwin",
    "GOVERSION": "go1.27.0",
    "gremlins_binary_sha256": "sha256:6a2beddc477eb410f8a670b6c9049558563d3c4327498fe31604d31c773a959e"
  },
  "completed_at": "2026-08-30T04:39:48.206627Z"
}
