{
  "schema_version": 1,
  "repository": "github.com/faustbrian/go-library-tools",
  "module": ".",
  "package": "internal/gates",
  "gate": "mutation",
  "input_digest": "sha256:e8198437d3a6cee179e4b3e61593bbf28bc4dd3d2d16c4a586869edcc6445531",
  "verifier_digest": "sha256:390cf4085a0063fe5dcaa29ce942ea4cb8c7876347da90376b65dc8c5c811104",
  "result": "passed",
  "report_digest": "sha256:1e825cf9930c5bb4fab7c5aafdd8cfe9986b03a5488837e85121772cf7163bb6",
  "environment": {
    "CGO_ENABLED": "1",
    "GOARCH": "amd64",
    "GOOS": "linux",
    "GOVERSION": "go1.27.2",
    "gremlins_binary_sha256": "sha256:433ea2397f2d68c0dd0e852ea755bf370b2bf10dee74e1261ab3c169dd9d82d0"
  },
  "completed_at": "2026-10-09T12:38:42.165053184Z"
}
