{
  "schema_version": 1,
  "repository": "github.com/faustbrian/go-library-tools",
  "module": ".",
  "package": "internal/cli",
  "gate": "mutation",
  "input_digest": "sha256:7e9a9c283c1d53c486d1c3c0f326b979b1c24582c8f62790121383906e0c94e5",
  "verifier_digest": "sha256:9a9499ff68a8dfd49a0be7995590297a8ee563a1aa226bfd8b9361dc53058108",
  "result": "passed",
  "report_digest": "sha256:5501693a6c9182c91c585b0eeee78ee2a61199f1ffb1e49f15ecae507ca0085c",
  "environment": {
    "CGO_ENABLED": "1",
    "GOARCH": "arm64",
    "GOOS": "darwin",
    "GOVERSION": "go1.27.0",
    "gremlins_binary_sha256": "sha256:6a2beddc477eb410f8a670b6c9049558563d3c4327498fe31604d31c773a959e"
  },
  "completed_at": "2026-08-27T02:18:47.820563Z"
}
