{
  "schema_version": 1,
  "repository": "github.com/faustbrian/go-library-tools",
  "module": ".",
  "package": "internal/cli",
  "gate": "mutation",
  "input_digest": "sha256:0e9d8b8c81cb9fa21b2539120c4429f44ab8ea7c60bc977bdc4b991a7e2a6388",
  "verifier_digest": "sha256:9a9499ff68a8dfd49a0be7995590297a8ee563a1aa226bfd8b9361dc53058108",
  "result": "passed",
  "report_digest": "sha256:7e1f6f227f098904bfd964dec31132eb7e6bb6eefc0d6a3465e2b7d1121327c8",
  "environment": {
    "CGO_ENABLED": "1",
    "GOARCH": "arm64",
    "GOOS": "darwin",
    "GOVERSION": "go1.27.0",
    "gremlins_binary_sha256": "sha256:6a2beddc477eb410f8a670b6c9049558563d3c4327498fe31604d31c773a959e"
  },
  "completed_at": "2026-08-27T01:15:55.719141Z"
}
